{
  "schema_version": "pgworkbench.hammerdb-v6-native-run-config/v1",
  "artifact_type": "pgworkbench.hammerdb-v6-native-run-config",
  "mode": "execute-only-prepared-schema",
  "postgresql": {
    "host": "127.0.0.1",
    "port": 5432,
    "user": "tpcc",
    "database": "tpcc",
    "sslmode": "prefer"
  },
  "tprocc": {
    "warehouses": 20,
    "virtual_users": 4,
    "rampup_minutes": 1,
    "duration_minutes": 2,
    "total_iterations": 1000000
  }
}
